{
  "schema_version": 2,
  "request_id": "request-offline-memory-001",
  "current_message_id": "message-user-memory-001",
  "allowed_event_ids": [],
  "interaction_mode": "Offline",
  "companion_id": "companion-01",
  "user_message": "오늘 중요한 일정이 있어서 조금 긴장된다고 말했어.",
  "time_context": {
    "source": "RealWorld",
    "observed_at": "2026-07-15T13:00:00+09:00",
    "timezone": "Asia/Seoul"
  },
  "game_context": {},
  "retrieved_memories": [],
  "allowed_commands": []
}
