{
  "schema_version": 2,
  "request_id": "request-ingame-command-001",
  "current_message_id": "message-user-command-001",
  "allowed_event_ids": [],
  "interaction_mode": "InGame",
  "companion_id": "companion-01",
  "user_message": "여기서 잠깐 기다려 줘.",
  "time_context": {
    "source": "GameWorld",
    "day": 18,
    "hour": 14.5,
    "period": "Afternoon"
  },
  "game_context": {
    "companion_state": "Following"
  },
  "retrieved_memories": [],
  "allowed_commands": ["Command.HoldPosition"]
}
